{
  "id": "decision.escalation_tie_takes_the_winners_friction_type",
  "kind": "decision",
  "description": "Two friction groups were last active at the same instant: the winner's group gives the last friction type.",
  "given": {
    "ruleset": {
      "schemaVersion": 1,
      "revision": 1,
      "updatedAt": "2026-10-01T00:00:00Z",
      "timeZone": "Australia/Sydney",
      "rules": [
        {
          "id": "r-ah-friction",
          "target": {
            "kind": "site",
            "domain": "reddit.com",
            "path": "/r/AskHistorians/**"
          },
          "mode": "friction",
          "schedules": [],
          "enabled": true
        },
        {
          "id": "r-a-reddit-friction",
          "target": {
            "kind": "site",
            "domain": "reddit.com"
          },
          "mode": "friction",
          "schedules": [],
          "enabled": true
        }
      ],
      "categories": [],
      "bedtime": {
        "enabled": true,
        "days": ["mon", "tue", "wed", "thu", "fri", "sat", "sun"],
        "start": "22:30",
        "end": "07:00",
        "warnMinutesBefore": 30
      },
      "workHours": {
        "days": ["mon", "tue", "wed", "thu", "fri"],
        "start": "09:00",
        "end": "17:30"
      }
    },
    "now": "2026-10-26T10:00:00+11:00",
    "state": {
      "escalation": [
        {
          "targetGroup": "r-ah-friction",
          "phase": "idle",
          "attemptCount": 1,
          "lastAttemptAt": "2026-10-25T22:50:00Z",
          "lastActivityAt": "2026-10-25T22:50:00Z",
          "brokenCount": 0,
          "lastFrictionType": "countdown",
          "gate": null,
          "pauseEndsAt": null,
          "pendingExtension": false,
          "intentionExpiresAt": null,
          "overrideReadyAt": null,
          "overrideEndsAt": null
        },
        {
          "targetGroup": "r-a-reddit-friction",
          "phase": "idle",
          "attemptCount": 1,
          "lastAttemptAt": "2026-10-25T22:50:00Z",
          "lastActivityAt": "2026-10-25T22:50:00Z",
          "brokenCount": 0,
          "lastFrictionType": "breath",
          "gate": null,
          "pauseEndsAt": null,
          "pendingExtension": false,
          "intentionExpiresAt": null,
          "overrideReadyAt": null,
          "overrideEndsAt": null
        }
      ],
      "usage": null,
      "unlocks": [],
      "guardianLinked": false
    }
  },
  "when": {
    "target": {
      "kind": "site",
      "urlText": "reddit.com/r/AskHistorians/comments/xyz789"
    }
  },
  "then": {
    "access": "gate",
    "content": "show",
    "ruleId": "r-ah-friction",
    "reason": "intention_required",
    "gate": {
      "level": 1,
      "pauseSeconds": 15,
      "frictionType": "breath",
      "requiresTypedIntention": false,
      "requiresGuardianKey": false
    },
    "explanationKey": "decision.intention_required",
    "validUntil": "2026-10-26T00:50:00Z"
  }
}
