{
  "id": "decision.budget_on_an_allow_rule_still_counts_under_a_more_specific_friction",
  "kind": "decision",
  "description": "Usage accrues to every matching budgeted rule: adding a more specific friction rule does not hide the exhausted budget of the allow rule.",
  "given": {
    "ruleset": {
      "schemaVersion": 1,
      "revision": 1,
      "updatedAt": "2026-10-01T00:00:00Z",
      "timeZone": "Australia/Sydney",
      "rules": [
        {
          "id": "r-watch-friction",
          "target": {
            "kind": "site",
            "domain": "youtube.com",
            "path": "/watch"
          },
          "mode": "friction",
          "schedules": [],
          "enabled": true
        },
        {
          "id": "r-yt-budget",
          "target": {
            "kind": "site",
            "domain": "youtube.com"
          },
          "mode": "allow",
          "schedules": [],
          "enabled": true,
          "dailyBudgetMinutes": 30
        }
      ],
      "categories": [],
      "bedtime": {
        "enabled": false,
        "days": ["mon", "tue", "wed", "thu", "fri", "sat", "sun"],
        "start": "22:30",
        "end": "07:00",
        "warnMinutesBefore": 30
      },
      "workHours": {
        "days": ["mon", "tue", "wed", "thu", "fri"],
        "start": "09:00",
        "end": "17:30"
      }
    },
    "now": "2026-10-26T10:00:00+11:00",
    "state": {
      "escalation": [],
      "usage": {
        "localDate": "2026-10-26",
        "secondsByRule": {
          "r-yt-budget": 1800
        }
      },
      "unlocks": [],
      "guardianLinked": false
    }
  },
  "when": {
    "target": {
      "kind": "site",
      "urlText": "https://www.youtube.com/watch?v=abc123DEF45"
    }
  },
  "then": {
    "access": "block",
    "content": "show",
    "ruleId": "r-yt-budget",
    "reason": "budget_exhausted",
    "explanationKey": "decision.budget_exhausted"
  }
}
