{
  "id": "specificity.path_rule_beats_domain_rule",
  "kind": "specificity",
  "description": "A site rule with a path is a refinement and beats the domain-wide rule.",
  "given": {
    "ruleset": {
      "schemaVersion": 1,
      "revision": 1,
      "updatedAt": "2026-10-01T00:00:00Z",
      "timeZone": "Australia/Sydney",
      "rules": [
        {
          "id": "r-ah-block",
          "target": {
            "kind": "site",
            "domain": "reddit.com",
            "path": "/r/AskHistorians/**"
          },
          "mode": "block",
          "schedules": [],
          "enabled": true
        },
        {
          "id": "r-reddit-allow",
          "target": {
            "kind": "site",
            "domain": "reddit.com"
          },
          "mode": "allow",
          "schedules": [],
          "enabled": true
        }
      ],
      "categories": [],
      "bedtime": {
        "enabled": true,
        "days": ["mon", "tue", "wed", "thu", "fri", "sat", "sun"],
        "start": "22:30",
        "end": "07:00",
        "warnMinutesBefore": 30
      },
      "workHours": {
        "days": ["mon", "tue", "wed", "thu", "fri"],
        "start": "09:00",
        "end": "17:30"
      }
    },
    "now": "2026-10-26T10:00:00+11:00",
    "state": {
      "escalation": [],
      "usage": null,
      "unlocks": [],
      "guardianLinked": false
    }
  },
  "when": {
    "target": {
      "kind": "site",
      "urlText": "https://www.reddit.com/r/AskHistorians/comments/xyz789/a_question/"
    }
  },
  "then": {
    "access": "block",
    "content": "show",
    "ruleId": "r-ah-block",
    "reason": "rule_match",
    "explanationKey": "decision.blocked_by_rule"
  }
}
