{
  "id": "decision.rule_on_an_alias_domain_matches_the_canonical_host",
  "kind": "decision",
  "description": "Rule domains are normalised like hosts: a rule on twitter.com applies to x.com.",
  "given": {
    "ruleset": {
      "schemaVersion": 1,
      "revision": 1,
      "updatedAt": "2026-10-01T00:00:00Z",
      "timeZone": "Australia/Sydney",
      "rules": [
        {
          "id": "r-tw-block",
          "target": {
            "kind": "site",
            "domain": "twitter.com"
          },
          "mode": "block",
          "schedules": [],
          "enabled": true
        }
      ],
      "categories": [],
      "bedtime": {
        "enabled": true,
        "days": ["mon", "tue", "wed", "thu", "fri", "sat", "sun"],
        "start": "22:30",
        "end": "07:00",
        "warnMinutesBefore": 30
      },
      "workHours": {
        "days": ["mon", "tue", "wed", "thu", "fri"],
        "start": "09:00",
        "end": "17:30"
      }
    },
    "now": "2026-10-26T10:00:00+11:00",
    "state": {
      "escalation": [],
      "usage": null,
      "unlocks": [],
      "guardianLinked": false
    }
  },
  "when": {
    "target": {
      "kind": "site",
      "urlText": "https://x.com/home"
    }
  },
  "then": {
    "access": "block",
    "content": "show",
    "ruleId": "r-tw-block",
    "reason": "rule_match",
    "explanationKey": "decision.blocked_by_rule"
  }
}
