{
  "id": "decision.twitter_alias_matches_x_rules",
  "kind": "decision",
  "description": "twitter.com is rewritten to x.com, so x.com rules apply to it.",
  "given": {
    "ruleset": {
      "schemaVersion": 1,
      "revision": 1,
      "updatedAt": "2026-10-01T00:00:00Z",
      "timeZone": "Australia/Sydney",
      "rules": [
        {
          "id": "r-x-block",
          "target": {
            "kind": "site",
            "domain": "x.com"
          },
          "mode": "block",
          "schedules": [],
          "enabled": true
        }
      ],
      "categories": [],
      "bedtime": {
        "enabled": true,
        "days": ["mon", "tue", "wed", "thu", "fri", "sat", "sun"],
        "start": "22:30",
        "end": "07:00",
        "warnMinutesBefore": 30
      },
      "workHours": {
        "days": ["mon", "tue", "wed", "thu", "fri"],
        "start": "09:00",
        "end": "17:30"
      }
    },
    "now": "2026-10-26T10:00:00+11:00",
    "state": {
      "escalation": [],
      "usage": null,
      "unlocks": [],
      "guardianLinked": false
    }
  },
  "when": {
    "target": {
      "kind": "site",
      "urlText": "https://twitter.com/home"
    }
  },
  "then": {
    "access": "block",
    "content": "show",
    "ruleId": "r-x-block",
    "reason": "rule_match",
    "explanationKey": "decision.blocked_by_rule",
    "validUntil": "2026-10-26T11:30:00Z"
  }
}
