{
  "id": "decision.reels_surface_is_blocked_in_the_app",
  "kind": "decision",
  "description": "The Reels tab in the Instagram app is blocked by the surface rule.",
  "given": {
    "ruleset": {
      "schemaVersion": 1,
      "revision": 1,
      "updatedAt": "2026-10-01T00:00:00Z",
      "timeZone": "Australia/Sydney",
      "rules": [
        {
          "id": "r-ig-app",
          "target": {
            "kind": "app",
            "package": "com.instagram.android"
          },
          "mode": "friction",
          "schedules": [],
          "enabled": true
        },
        {
          "id": "r-ig-dm-reel",
          "target": {
            "kind": "surface",
            "surface": "instagram.reel_from_dm"
          },
          "mode": "allow",
          "schedules": [],
          "enabled": true
        },
        {
          "id": "r-ig-reels",
          "target": {
            "kind": "surface",
            "surface": "instagram.reels"
          },
          "mode": "block",
          "schedules": [],
          "enabled": true
        }
      ],
      "categories": [],
      "bedtime": {
        "enabled": true,
        "days": ["mon", "tue", "wed", "thu", "fri", "sat", "sun"],
        "start": "22:30",
        "end": "07:00",
        "warnMinutesBefore": 30
      },
      "workHours": {
        "days": ["mon", "tue", "wed", "thu", "fri"],
        "start": "09:00",
        "end": "17:30"
      }
    },
    "now": "2026-10-26T10:00:00+11:00",
    "state": {
      "escalation": [],
      "usage": null,
      "unlocks": [],
      "guardianLinked": false
    }
  },
  "when": {
    "target": {
      "kind": "app",
      "package": "com.instagram.android",
      "surface": "instagram.reels"
    }
  },
  "then": {
    "access": "block",
    "content": "show",
    "ruleId": "r-ig-reels",
    "reason": "rule_match",
    "explanationKey": "decision.blocked_by_rule",
    "validUntil": "2026-10-26T11:30:00Z"
  }
}
