{
  "id": "decision.budget_day_follows_the_pinned_zone",
  "kind": "decision",
  "description": "Usage is dated in the pinned zone: at 01:00 on 27 October in Sydney (still 26 October in UTC) the budget of the 27th counts.",
  "given": {
    "ruleset": {
      "schemaVersion": 1,
      "revision": 1,
      "updatedAt": "2026-10-01T00:00:00Z",
      "timeZone": "Australia/Sydney",
      "rules": [
        {
          "id": "r-yt-budget",
          "target": {
            "kind": "site",
            "domain": "youtube.com"
          },
          "mode": "allow",
          "schedules": [],
          "enabled": true,
          "dailyBudgetMinutes": 30
        }
      ],
      "categories": [],
      "bedtime": {
        "enabled": false,
        "days": ["mon", "tue", "wed", "thu", "fri", "sat", "sun"],
        "start": "22:30",
        "end": "07:00",
        "warnMinutesBefore": 30
      },
      "workHours": {
        "days": ["mon", "tue", "wed", "thu", "fri"],
        "start": "09:00",
        "end": "17:30"
      }
    },
    "now": "2026-10-26T14:00:00Z",
    "state": {
      "escalation": [],
      "usage": {
        "localDate": "2026-10-27",
        "secondsByRule": {
          "r-yt-budget": 1800
        }
      },
      "unlocks": [],
      "guardianLinked": false
    }
  },
  "when": {
    "target": {
      "kind": "site",
      "urlText": "https://www.youtube.com/watch?v=abc123DEF45"
    }
  },
  "then": {
    "access": "block",
    "content": "show",
    "ruleId": "r-yt-budget",
    "reason": "budget_exhausted",
    "explanationKey": "decision.budget_exhausted",
    "validUntil": "2026-10-27T13:00:00Z"
  }
}
