{
  "id": "decision.hide_feed_with_unknown_path_gates_instead_of_hiding",
  "kind": "decision",
  "description": "With only the domain visible nothing is hidden (it may be a permalink), but the feed rule of a profiled site never fails open: it gates.",
  "given": {
    "ruleset": {
      "schemaVersion": 1,
      "revision": 1,
      "updatedAt": "2026-10-01T00:00:00Z",
      "timeZone": "Australia/Sydney",
      "rules": [
        {
          "id": "r-reddit-hide",
          "target": {
            "kind": "site",
            "domain": "reddit.com"
          },
          "mode": "hide-feed",
          "schedules": [],
          "enabled": true
        }
      ],
      "categories": [],
      "bedtime": {
        "enabled": true,
        "days": ["mon", "tue", "wed", "thu", "fri", "sat", "sun"],
        "start": "22:30",
        "end": "07:00",
        "warnMinutesBefore": 30
      },
      "workHours": {
        "days": ["mon", "tue", "wed", "thu", "fri"],
        "start": "09:00",
        "end": "17:30"
      }
    },
    "now": "2026-10-26T10:00:00+11:00",
    "state": {
      "escalation": [],
      "usage": null,
      "unlocks": [],
      "guardianLinked": false
    }
  },
  "when": {
    "target": {
      "kind": "site",
      "urlText": "reddit.com"
    }
  },
  "then": {
    "access": "gate",
    "content": "show",
    "ruleId": "r-reddit-hide",
    "reason": "intention_required",
    "gate": {
      "level": 0,
      "pauseSeconds": 5,
      "frictionType": "countdown",
      "requiresTypedIntention": false,
      "requiresGuardianKey": false
    },
    "explanationKey": "decision.intention_required"
  }
}
