{
  "id": "decision.rule_kept_by_a_waiting_work_hours_switch_still_gates",
  "kind": "decision",
  "description": "While the switch to work hours waits, the effective rule set keeps the always-on friction rule: at 20:00 on a Monday it still gates.",
  "given": {
    "ruleset": {
      "schemaVersion": 1,
      "revision": 2,
      "updatedAt": "2026-10-26T04:00:00Z",
      "timeZone": "Australia/Sydney",
      "rules": [
        {
          "id": "r-reddit-friction",
          "target": {
            "kind": "site",
            "domain": "reddit.com"
          },
          "mode": "friction",
          "schedules": [],
          "enabled": true
        }
      ],
      "categories": [],
      "bedtime": {
        "enabled": false,
        "days": ["mon", "tue", "wed", "thu", "fri", "sat", "sun"],
        "start": "22:30",
        "end": "07:00",
        "warnMinutesBefore": 30
      },
      "workHours": {
        "days": ["mon", "tue", "wed", "thu", "fri"],
        "start": "09:00",
        "end": "17:00"
      }
    },
    "now": "2026-10-26T20:00:00+11:00",
    "state": {
      "escalation": [],
      "usage": null,
      "unlocks": [],
      "guardianLinked": false
    }
  },
  "when": {
    "target": {
      "kind": "site",
      "urlText": "https://www.reddit.com/r/AskHistorians/"
    }
  },
  "then": {
    "access": "gate",
    "content": "show",
    "ruleId": "r-reddit-friction",
    "reason": "intention_required",
    "gate": {
      "level": 0,
      "pauseSeconds": 5,
      "frictionType": "countdown",
      "requiresTypedIntention": false,
      "requiresGuardianKey": false
    },
    "explanationKey": "decision.intention_required"
  }
}
