{
  "id": "decision.bedtime_follows_the_pinned_zone_not_the_device",
  "kind": "decision",
  "description": "The rule set is pinned to Sydney: at 23:00 Sydney bedtime applies even if the device clock shows 12:00 in another zone.",
  "given": {
    "ruleset": {
      "schemaVersion": 1,
      "revision": 1,
      "updatedAt": "2026-10-01T00:00:00Z",
      "timeZone": "Australia/Sydney",
      "rules": [
        {
          "id": "starter-instagram-explore-hide",
          "target": {
            "kind": "surface",
            "surface": "instagram.explore"
          },
          "mode": "hide-feed",
          "schedules": [],
          "enabled": true
        },
        {
          "id": "starter-instagram-reels-hide",
          "target": {
            "kind": "surface",
            "surface": "instagram.reels"
          },
          "mode": "hide-feed",
          "schedules": [],
          "enabled": true
        },
        {
          "id": "starter-reddit-feed-hide",
          "target": {
            "kind": "surface",
            "surface": "reddit.feed"
          },
          "mode": "hide-feed",
          "schedules": [],
          "enabled": true
        },
        {
          "id": "starter-reddit-friction",
          "target": {
            "kind": "site",
            "domain": "reddit.com"
          },
          "mode": "friction",
          "schedules": [],
          "enabled": true
        },
        {
          "id": "starter-x-explore-hide",
          "target": {
            "kind": "surface",
            "surface": "x.explore"
          },
          "mode": "hide-feed",
          "schedules": [],
          "enabled": true
        },
        {
          "id": "starter-x-friction",
          "target": {
            "kind": "site",
            "domain": "x.com"
          },
          "mode": "friction",
          "schedules": [],
          "enabled": true
        },
        {
          "id": "starter-x-home-hide",
          "target": {
            "kind": "surface",
            "surface": "x.home"
          },
          "mode": "hide-feed",
          "schedules": [],
          "enabled": true
        },
        {
          "id": "starter-youtube-home-hide",
          "target": {
            "kind": "surface",
            "surface": "youtube.home"
          },
          "mode": "hide-feed",
          "schedules": [],
          "enabled": true
        },
        {
          "id": "starter-youtube-explore-hide",
          "target": {
            "kind": "surface",
            "surface": "youtube.explore"
          },
          "mode": "hide-feed",
          "schedules": [],
          "enabled": true
        },
        {
          "id": "starter-youtube-shorts-block",
          "target": {
            "kind": "surface",
            "surface": "youtube.shorts"
          },
          "mode": "block",
          "schedules": [],
          "enabled": true
        }
      ],
      "categories": [],
      "bedtime": {
        "enabled": true,
        "days": ["mon", "tue", "wed", "thu", "fri", "sat", "sun"],
        "start": "22:30",
        "end": "07:00",
        "warnMinutesBefore": 30
      },
      "workHours": {
        "days": ["mon", "tue", "wed", "thu", "fri"],
        "start": "09:00",
        "end": "17:30"
      }
    },
    "now": "2026-10-26T12:00:00Z",
    "state": {
      "escalation": [],
      "usage": null,
      "unlocks": [],
      "guardianLinked": false
    }
  },
  "when": {
    "target": {
      "kind": "site",
      "urlText": "https://www.instagram.com/"
    }
  },
  "then": {
    "access": "block",
    "content": "show",
    "ruleId": null,
    "reason": "schedule_bedtime",
    "explanationKey": "decision.schedule_bedtime",
    "validUntil": "2026-10-26T20:00:00Z"
  }
}
