{
  "id": "decision.rule_ids_named_like_object_members_are_plain_ids",
  "kind": "decision",
  "description": "Rule ids such as `constructor` are ordinary ids: lookups by id never reach an object prototype, so the unspent budget and the missing escalation state count as empty.",
  "given": {
    "ruleset": {
      "schemaVersion": 1,
      "revision": 1,
      "updatedAt": "2026-10-01T00:00:00Z",
      "timeZone": "Australia/Sydney",
      "rules": [
        {
          "id": "constructor",
          "target": {
            "kind": "site",
            "domain": "reddit.com"
          },
          "mode": "friction",
          "schedules": [],
          "enabled": true,
          "dailyBudgetMinutes": 30
        }
      ],
      "categories": [],
      "bedtime": {
        "enabled": true,
        "days": ["mon", "tue", "wed", "thu", "fri", "sat", "sun"],
        "start": "22:30",
        "end": "07:00",
        "warnMinutesBefore": 30
      },
      "workHours": {
        "days": ["mon", "tue", "wed", "thu", "fri"],
        "start": "09:00",
        "end": "17:30"
      }
    },
    "now": "2026-10-26T10:00:00+11:00",
    "state": {
      "escalation": [],
      "usage": {
        "localDate": "2026-10-26",
        "secondsByRule": {
          "toString": 1800
        }
      },
      "unlocks": [],
      "guardianLinked": false
    }
  },
  "when": {
    "target": {
      "kind": "site",
      "urlText": "https://www.reddit.com/r/AskHistorians/"
    }
  },
  "then": {
    "access": "gate",
    "content": "show",
    "ruleId": "constructor",
    "reason": "intention_required",
    "gate": {
      "level": 0,
      "pauseSeconds": 5,
      "frictionType": "countdown",
      "requiresTypedIntention": false,
      "requiresGuardianKey": false
    },
    "explanationKey": "decision.intention_required",
    "validUntil": "2026-10-26T11:30:00Z"
  }
}
