{
  "id": "specificity.path_rule_never_matches_an_unknown_path",
  "kind": "specificity",
  "description": "When only the domain is visible a path allow rule cannot loosen anything: the strictest rule of the domain applies.",
  "given": {
    "ruleset": {
      "schemaVersion": 1,
      "revision": 1,
      "updatedAt": "2026-10-01T00:00:00Z",
      "timeZone": "Australia/Sydney",
      "rules": [
        {
          "id": "r-ml-allow",
          "target": {
            "kind": "site",
            "domain": "reddit.com",
            "path": "/r/MachineLearning/**"
          },
          "mode": "allow",
          "schedules": [],
          "enabled": true
        },
        {
          "id": "r-reddit-friction",
          "target": {
            "kind": "site",
            "domain": "reddit.com"
          },
          "mode": "friction",
          "schedules": [],
          "enabled": true
        }
      ],
      "categories": [],
      "bedtime": {
        "enabled": true,
        "days": ["mon", "tue", "wed", "thu", "fri", "sat", "sun"],
        "start": "22:30",
        "end": "07:00",
        "warnMinutesBefore": 30
      },
      "workHours": {
        "days": ["mon", "tue", "wed", "thu", "fri"],
        "start": "09:00",
        "end": "17:30"
      }
    },
    "now": "2026-10-26T10:00:00+11:00",
    "state": {
      "escalation": [],
      "usage": null,
      "unlocks": [],
      "guardianLinked": false
    }
  },
  "when": {
    "target": {
      "kind": "site",
      "urlText": "reddit.com"
    }
  },
  "then": {
    "access": "gate",
    "content": "show",
    "ruleId": "r-reddit-friction",
    "reason": "intention_required",
    "gate": {
      "level": 0,
      "pauseSeconds": 5,
      "frictionType": "countdown",
      "requiresTypedIntention": false,
      "requiresGuardianKey": false
    },
    "explanationKey": "decision.intention_required"
  }
}
