{
  "id": "decision.hide_feed_beats_allow_at_equal_specificity",
  "kind": "decision",
  "description": "Allow and hide-feed on the same surface: the stricter hide-feed wins the content axis while access stays allowed.",
  "given": {
    "ruleset": {
      "schemaVersion": 1,
      "revision": 1,
      "updatedAt": "2026-10-01T00:00:00Z",
      "timeZone": "Australia/Sydney",
      "rules": [
        {
          "id": "r-feed-allow",
          "target": {
            "kind": "surface",
            "surface": "reddit.feed"
          },
          "mode": "allow",
          "schedules": [],
          "enabled": true
        },
        {
          "id": "r-feed-hide",
          "target": {
            "kind": "surface",
            "surface": "reddit.feed"
          },
          "mode": "hide-feed",
          "schedules": [],
          "enabled": true
        }
      ],
      "categories": [],
      "bedtime": {
        "enabled": true,
        "days": ["mon", "tue", "wed", "thu", "fri", "sat", "sun"],
        "start": "22:30",
        "end": "07:00",
        "warnMinutesBefore": 30
      },
      "workHours": {
        "days": ["mon", "tue", "wed", "thu", "fri"],
        "start": "09:00",
        "end": "17:30"
      }
    },
    "now": "2026-10-26T10:00:00+11:00",
    "state": {
      "escalation": [],
      "usage": null,
      "unlocks": [],
      "guardianLinked": false
    }
  },
  "when": {
    "target": {
      "kind": "site",
      "urlText": "reddit.com/"
    }
  },
  "then": {
    "access": "allow",
    "content": "hide-feed",
    "ruleId": "r-feed-hide",
    "reason": "rule_match",
    "explanationKey": "decision.feed_hidden",
    "validUntil": "2026-10-26T11:30:00Z"
  }
}
