{
  "id": "decision.valid_until_sees_the_repeated_fall_back_hour",
  "kind": "decision",
  "description": "At 02:45 AEDT a 01:00 to 02:30 block is over, but at 03:00 AEDT the clock falls back to 02:00 AEST and the block applies again.",
  "given": {
    "ruleset": {
      "schemaVersion": 1,
      "revision": 1,
      "updatedAt": "2026-03-01T00:00:00Z",
      "timeZone": "Australia/Sydney",
      "rules": [
        {
          "id": "r-x-block",
          "target": {
            "kind": "site",
            "domain": "x.com"
          },
          "mode": "block",
          "schedules": [
            {
              "days": ["sun"],
              "start": "01:00",
              "end": "02:30"
            }
          ],
          "enabled": true
        }
      ],
      "categories": [],
      "bedtime": {
        "enabled": false,
        "days": ["mon", "tue", "wed", "thu", "fri", "sat", "sun"],
        "start": "22:30",
        "end": "07:00",
        "warnMinutesBefore": 30
      },
      "workHours": {
        "days": ["mon", "tue", "wed", "thu", "fri"],
        "start": "09:00",
        "end": "17:30"
      }
    },
    "now": "2026-04-05T02:45:00+11:00",
    "state": {
      "escalation": [],
      "usage": null,
      "unlocks": [],
      "guardianLinked": false
    }
  },
  "when": {
    "target": {
      "kind": "site",
      "urlText": "x.com/home"
    }
  },
  "then": {
    "access": "allow",
    "content": "show",
    "ruleId": null,
    "reason": "no_rule",
    "explanationKey": "decision.no_rule",
    "validUntil": "2026-04-04T16:00:00Z"
  }
}
