{
  "id": "decision.budget_on_a_non_winning_candidate_blocks",
  "kind": "decision",
  "description": "An exhausted budget on the domain rule blocks even where a more specific allow rule wins.",
  "given": {
    "ruleset": {
      "schemaVersion": 1,
      "revision": 1,
      "updatedAt": "2026-10-01T00:00:00Z",
      "timeZone": "Australia/Sydney",
      "rules": [
        {
          "id": "r-ml-allow",
          "target": {
            "kind": "site",
            "domain": "reddit.com",
            "path": "/r/MachineLearning/**"
          },
          "mode": "allow",
          "schedules": [],
          "enabled": true
        },
        {
          "id": "r-reddit-friction",
          "target": {
            "kind": "site",
            "domain": "reddit.com"
          },
          "mode": "friction",
          "schedules": [],
          "enabled": true,
          "dailyBudgetMinutes": 30
        }
      ],
      "categories": [],
      "bedtime": {
        "enabled": false,
        "days": ["mon", "tue", "wed", "thu", "fri", "sat", "sun"],
        "start": "22:30",
        "end": "07:00",
        "warnMinutesBefore": 30
      },
      "workHours": {
        "days": ["mon", "tue", "wed", "thu", "fri"],
        "start": "09:00",
        "end": "17:30"
      }
    },
    "now": "2026-10-26T10:00:00+11:00",
    "state": {
      "escalation": [],
      "usage": {
        "localDate": "2026-10-26",
        "secondsByRule": {
          "r-reddit-friction": 1800
        }
      },
      "unlocks": [],
      "guardianLinked": false
    }
  },
  "when": {
    "target": {
      "kind": "site",
      "urlText": "https://www.reddit.com/r/MachineLearning/"
    }
  },
  "then": {
    "access": "block",
    "content": "show",
    "ruleId": "r-reddit-friction",
    "reason": "budget_exhausted",
    "explanationKey": "decision.budget_exhausted",
    "validUntil": "2026-10-26T13:00:00Z"
  }
}
